{
  "$schema": "https://json-schema.org/draft/2020-12/schema",
  "type": "array",
  "items": {
    "type": "object",
    "properties": {
      "id": {
        "type": "string",
        "minLength": 1
      },
      "projectId": {
        "type": [
          "string",
          "null"
        ],
        "minLength": 1
      },
      "claimIds": {
        "type": "array",
        "items": {
          "type": "string",
          "minLength": 1
        },
        "uniqueItems": true
      },
      "utilityId": {
        "type": [
          "string",
          "null"
        ],
        "minLength": 1
      },
      "status": {
        "type": "string",
        "minLength": 1
      }
    },
    "required": [
      "id",
      "projectId",
      "claimIds",
      "utilityId",
      "status"
    ],
    "additionalProperties": false
  },
  "uniqueItems": true
}
